<?xml version="1.0" encoding="UTF-8"?>
<!DOCTYPE generatorConfiguration PUBLIC "-//mybatis.org//DTD MyBatis Generator Configuration 1.0//EN"
		"classpath:dtd/mybatis-generator-config_1_0.dtd">

<generatorConfiguration>
	<properties resource="generator.properties" />

	<context id="mysqlMap" targetRuntime="MyBatis3">

		<property name="xmlFormatter" value="com.stip.mybatis.generator.formatter.CustomXmlFormatter"/>

		<plugin type="org.mybatis.generator.plugins.SerializablePlugin" />
		<plugin type="org.mybatis.generator.plugins.ToStringPlugin" />
		<plugin type="com.stip.mybatis.generator.plugin.MysqlPaginationPlugin"/>
		<plugin type="com.stip.mybatis.generator.plugin.BooleanColumnPlugin" />

		<plugin type="com.stip.mybatis.generator.plugin.ExampleClassPlugin">
			<property name="targetProject" value="${targetProject}" />
			<property name="targetPackage" value="${targetPackage}" />
			<property name="exampleTargetPackage" value="${exampleTargetPackage}" />
			<property name="xmlTargetPackage" value="${xmlTargetPackage}" />
			<property name="modelTargetPackage" value="${modelTargetPackage}" />
			<property name="exampleTargetProject" value="${exampleTargetDir}" />
		</plugin>

		<plugin type="com.stip.mybatis.generator.plugin.ExtendXmlMapperPlugin">
			<property name="targetProject" value="${targetProject}" />
			<property name="targetPackage" value="${targetPackage}" />
			<property name="exampleTargetPackage" value="${exampleTargetPackage}" />
			<property name="xmlTargetPackage" value="${xmlTargetPackage}" />
			<property name="modelTargetPackage" value="${modelTargetPackage}" />
			<property name="enableXmlFormat" value="true"/>
			<property name="enableCache" value="true"/>
			<property name="enableComments" value="true"/>
		</plugin>

		<plugin type="com.stip.mybatis.generator.plugin.ModelClassPlugin">
			<property name="targetProject" value="${targetProject}" />
			<property name="targetPackage" value="${targetPackage}" />
			<property name="modelTargetPackage" value="${modelTargetPackage}" />
			<property name="modelTargetProject" value="${modelTargetDir}" />
		</plugin>

		<plugin type="com.stip.mybatis.generator.plugin.MapperPlugin">
			<property name="targetProject" value="${targetProject}" />
			<property name="targetPackage" value="${targetPackage}" />
			<property name="daoTargetDir" value="${daoTargetDir}" />
			<property name="daoTargetPackage" value="${daoTargetPackage}" />
			<property name="modelTargetPackage" value="${modelTargetPackage}" />
		</plugin>

		<plugin type="com.stip.mybatis.generator.plugin.ServiceInterfacePlugin">
			<property name="targetProject" value="${targetProject}" />
			<property name="targetPackage" value="${targetPackage}" />
			<property name="serviceTargetDir" value="${serviceTargetDir}" />
			<property name="serviceInterfaceTargetPackage" value="${serviceInterfaceTargetPackage}" />
			<property name="modelTargetPackage" value="${modelTargetPackage}" />
		</plugin>

		<plugin type="com.stip.mybatis.generator.plugin.ServicePlugin">
			<property name="targetProject" value="${targetProject}" />
			<property name="targetPackage" value="${targetPackage}" />
			<property name="serviceTargetDir" value="${serviceTargetDir}" />
			<property name="serviceTargetPackage" value="${serviceTargetPackage}" />
			<property name="modelTargetPackage" value="${modelTargetPackage}" />
			<property name="serviceInterfaceTargetPackage" value="${serviceInterfaceTargetPackage}" />
		</plugin>

		<plugin type="com.stip.mybatis.generator.plugin.LombokPlugin">
			<property name="useLombokPlugin" value="${useLombokPlugin}" />
			<property name="lombokAnnotations" value="${lombokAnnotations}" />
		</plugin>

		<commentGenerator>
			<property name="suppressAllComments" value="true" />
		</commentGenerator>

		<jdbcConnection driverClass="${jdbc.driverClassName}" connectionURL="${jdbc.url}" userId="${jdbc.username}" password="${jdbc.password}" />

		<javaTypeResolver>
			<property name="forceBigDecimals" value="false" />
		</javaTypeResolver>

		<!--domain 代码 生成路径 -->
		<javaModelGenerator targetPackage="${targetPackage}" targetProject="${targetProject}">
			<property name="trimStrings" value="true" />
		</javaModelGenerator>

		<!--mapper 代码 生成路径 -->
		<sqlMapGenerator targetPackage="${targetPackage}" targetProject="${targetProject}">
			<property name="enableSubPackages" value="true" />
		</sqlMapGenerator>
		<table catalog="${database}" tableName="${tableName}" ></table>


	</context>
</generatorConfiguration>